{
  "version": 1,
  "reviewed_at": "2026-09-14",
  "drive_id": "1CVuFsr-nM-74P_R2Sn6Zx1CE5pnRu9fxap_mK7GAvEM",
  "url": "https://docs.google.com/spreadsheets/d/1CVuFsr-nM-74P_R2Sn6Zx1CE5pnRu9fxap_mK7GAvEM/edit",
  "snapshot": "documents/sources/gsi/Mapa_GSI_A2_57_temas.csv",
  "sha256": "edaa1be34a1f8b5f8642bea1499a8f36be03f8b6001e47247b91d58517b77084",
  "program_rows": 57,
  "distribution": [
    10,
    16,
    15,
    16
  ],
  "decision": "La primera hoja contiene los 57 temas en orden coincidente con Anexo IX. El CSV reúne también otras hojas con cabeceras distintas; no se importan como temas adicionales.",
  "differences": [
    {
      "topic_id": "B1-T03",
      "auxiliary": "Gobierno y Administración",
      "decision": "Se usa íntegro el título BOE, delimitado al Gobierno y sus relaciones con las Cortes."
    },
    {
      "topic_id": "B1-T04",
      "auxiliary": "Incluye gobierno abierto en el rótulo resumido",
      "decision": "Se usa el título BOE (Ley 19/2013, Agenda 2030 y ODS); el mapa es una ayuda."
    }
  ],
  "catalog_discrepancy": "El catálogo antiguo preveía 55 temas GSI; se corrige a 57."
}
